{"schema_version":2,"release_id":"2026-09-02.1","created_at":"2026-09-02T00:00:00Z","approved_by":"synthetic-fixture-review","approved_at":"2026-09-02T00:00:00Z","package_digest":"5c2a84e4f0e71c5ebb646b217b4a8c364d6c583eb31a88ec61e4826386809140","runtime_capability_version":2,"route_schema_version":1,"limits":{"max_request_body":4096,"max_sink_body":4096,"max_connections":4},"artifacts":[{"role":"adapter_eeprom","content_id":"adapter-eeprom","path":"adapter-eeprom-template.bin","size":18,"sha256":"787599967f145a6f2f33ec79716da2bec5899f8980af7f7a4f393fb9d7b62eb3"},{"role":"dns_routes","content_id":"dns-routes","path":"dns-routes.json","size":89,"sha256":"5cef38114fc3761473a0175c118f6c43e430f944929152a43020961cb509e2fb"},{"role":"http_routes","content_id":"http-routes","path":"http-routes.json","size":436,"sha256":"9deb2a14a02a3ef6bd8c2c72b9124cffe6a8bb62c0ee4b1bbf67b340f0b0b933"},{"role":"content_number","content_id":"number-a","path":"content/number.txt","size":3,"sha256":"084c799cd551dd1d8d5c5f9a5d593b2e931f5e36122ee5c793c1d08a19839cc0"}],"materializers":[],"rollback_release_id":null}
