{"schema_version":2,"release_id":"2026-09-02.1","created_at":"2026-09-02T00:00:00Z","approved_by":"synthetic-fixture-review","approved_at":"2026-09-02T00:00:00Z","package_digest":"c7c6f7610bac6e46708c7ec48f3e6327ecb131b8d71e02a15bf76c40679d8eab","runtime_capability_version":2,"route_schema_version":1,"limits":{"max_request_body":4096,"max_sink_body":4096,"max_connections":4},"artifacts":[{"role":"adapter_eeprom","content_id":"adapter-eeprom","path":"adapter-eeprom-template.bin","size":18,"sha256":"2cc5ba6b6fd016f902ea2485e27d20a53adc51cf5d3b078d681fcb69c7283bff"},{"role":"dns_routes","content_id":"dns-routes","path":"dns-routes.json","size":89,"sha256":"34d06b5e1faef918cfea19301fdf7ecb6839cf841f3eb47d2a926bf007f2cee2"},{"role":"http_routes","content_id":"http-routes","path":"http-routes.json","size":302,"sha256":"c90adb8d20ee8aec1862ea87d0d9eda2b9579f3ad3621ac052fc7394ec96c055"},{"role":"content_number","content_id":"number-b","path":"content/number.txt","size":4,"sha256":"e3b9c2844b5a5c2677b3a2279db2ec8487491dd9a23d6b22fac153391b3bb63c"}],"materializers":[],"rollback_release_id":null}
